{
  "$schema": "http://json-schema.org/draft-07/schema#",
  "title": "Startup Receipt",
  "description": "Canonical startup receipt format for Librarian Nodes",
  "type": "object",
  "required": [
    "receipt_id",
    "node_id",
    "platform",
    "governance_commit",
    "startup_phase",
    "identity_loaded",
    "governance_verified",
    "capabilities_loaded",
    "environment_validated",
    "checks_passed",
    "checks_failed",
    "status",
    "timestamp"
  ],
  "properties": {
    "receipt_id": {
      "type": "string",
      "description": "Unique receipt identifier",
      "pattern": "^[A-Z0-9-]+$"
    },
    "node_id": {
      "type": "string",
      "description": "Unique node identifier",
      "minLength": 1
    },
    "platform": {
      "type": "string",
      "description": "Node platform",
      "enum": ["windows", "linux", "macos"]
    },
    "governance_commit": {
      "type": "string",
      "description": "Canonical governance commit SHA",
      "pattern": "^[a-f0-9]{40}$"
    },
    "startup_phase": {
      "type": "string",
      "description": "Current startup phase",
      "enum": ["complete", "failed"]
    },
    "identity_loaded": {
      "type": "boolean",
      "description": "Whether identity was loaded successfully"
    },
    "governance_verified": {
      "type": "boolean",
      "description": "Whether governance was verified successfully"
    },
    "capabilities_loaded": {
      "type": "boolean",
      "description": "Whether capabilities were loaded successfully"
    },
    "environment_validated": {
      "type": "boolean",
      "description": "Whether environment was validated successfully"
    },
    "checks_passed": {
      "type": "integer",
      "description": "Number of checks that passed",
      "minimum": 0
    },
    "checks_failed": {
      "type": "integer",
      "description": "Number of checks that failed",
      "minimum": 0
    },
    "status": {
      "type": "string",
      "description": "Node status after startup",
      "enum": ["GOVERNED_EXECUTION", "STARTUP_FAILED"]
    },
    "timestamp": {
      "type": "string",
      "description": "ISO-8601 timestamp of receipt generation",
      "format": "date-time"
    }
  }
}
