{
    "receipt_id": "LINUX-STARTUP-20260724-223400",
    "node_id": "LINUX-NODE-INITIAL",
    "platform": "linux",
    "governance_commit": "6be76216a8048492526c4ca0ae751b6d2d507185",
    "startup_phase": "complete",
    "identity_loaded": true,
    "governance_verified": true,
    "capabilities_loaded": true,
    "environment_validated": true,
    "checks_passed": 6,
    "checks_failed": 0,
    "status": "GOVERNED_EXECUTION",
    "timestamp": "2026-07-25T02:34:00.0000000Z"
}
